{
  "schema_version": "runsteward.handoff/v1",
  "handoff_id": "handoff:atomic-full-01:1",
  "run_id": "run:atomic-full-01",
  "created_at": "2026-07-14T00:11:00Z",
  "checkpoint_ref": {
    "ref": "contracts/fixtures/scenarios/checkpoint.atomic-full-01.claude-not-required.json",
    "digest": "sha256:14f59770d4d26a62567f48a7d37aa2667461c19684751d04a7042a678fad4fab"
  },
  "status": "checkpointed",
  "outcome_summary": "The contract checkpoint is complete and contains no provider credentials or raw transcripts.",
  "completed_items": [
    "Schemas and frozen authority bindings were validated locally."
  ],
  "remaining_items": [
    "Run imported-package regressions."
  ],
  "blockers": [],
  "decisions_required": [],
  "approvals_required": [],
  "validation_summary": [],
  "changed_paths_summary": [],
  "failed_commands_summary": [],
  "safe_resume": {
    "eligible": true,
    "preconditions": [
      "Use the same run ID and a new verified lease epoch."
    ],
    "adapter_id": "claude-code-local",
    "identity_reference_digest": null,
    "invocation_template": "npm.cmd test --prefix packages/runsteward-core"
  },
  "redactions": [
    {
      "class": "private-prompt",
      "replacement": "[REDACTED_PRIVATE_PROMPT]",
      "source_ref": "evidence/raw/private-prompt.txt"
    }
  ],
  "raw_evidence_refs": [],
  "handoff_digest": "sha256:ec846f9a0c9bff89e1afd881510cb61bb1df9c8f014e2a4fc4fae209a3581234"
}
