{
  "schema_version": "runsteward.handoff/v1",
  "handoff_id": "handoff:atomic-full-codex-01:1",
  "run_id": "run:atomic-full-codex-01",
  "created_at": "2026-07-14T00:11:00Z",
  "checkpoint_ref": {
    "ref": "contracts/fixtures/scenarios/checkpoint.atomic-full-codex-01.codex-verified.json",
    "digest": "sha256:c47e826309f0e3d0df2dc3c3e8d0efbbdc631b6d7cbb5a82038976ccc30d377f"
  },
  "status": "checkpointed",
  "outcome_summary": "The contract checkpoint is complete and contains no provider credentials or raw transcripts.",
  "completed_items": [
    "Schemas and frozen authority bindings were validated locally."
  ],
  "remaining_items": [
    "Run imported-package regressions."
  ],
  "blockers": [],
  "decisions_required": [],
  "approvals_required": [],
  "validation_summary": [],
  "changed_paths_summary": [],
  "failed_commands_summary": [],
  "safe_resume": {
    "eligible": true,
    "preconditions": [
      "Use the same run ID and a new verified lease epoch."
    ],
    "adapter_id": "codex-local",
    "identity_reference_digest": "sha256:cccccccccccccccccccccccccccccccccccccccccccccccccccccccccccccccc",
    "invocation_template": "npm.cmd test --prefix packages/runsteward-core"
  },
  "redactions": [
    {
      "class": "private-prompt",
      "replacement": "[REDACTED_PRIVATE_PROMPT]",
      "source_ref": "evidence/raw/private-prompt.txt"
    }
  ],
  "raw_evidence_refs": [],
  "handoff_digest": "sha256:c8e5afdb39440ae0a64747243a770f02860244bae6e81d666ab76122ba004950"
}
